### ISSUE TITLE
DNS queries to `<FQDN>.test.iseja.net.`, e.g. `github.com.test.iseja.net.`

### ISSUE THREAD

**Issue by sebiklamar** [isejalabs/homelab#375]
DNS queries to `<FQDN>.test.iseja.net.`, e.g. `github.com.test.iseja.net.`

```
06:55:59.275254 IP 10.7.8.134.44157 > 10.8.8.8.53: 32189+ AAAA? crash-report-service.svc.ui.com.test.iseja.net. (64)
06:55:59.275313 IP 10.7.8.134.44339 > 10.9.9.9.53: 62724+ A? crash-report-service.svc.ui.com.test.iseja.net. (64)
07:07:01.403179 IP 10.7.8.134.35939 > 10.9.9.9.53: 31023+ AAAA? trace.svc.ui.com.test.iseja.net. (49)
07:07:01.403379 IP 10.7.8.134.39330 > 10.8.8.8.53: 5840+ A? trace.svc.ui.com.test.iseja.net. (49)
07:09:25.511057 IP 10.7.8.134.44157 > 10.9.9.9.53: 35978+ AAAA? static.ui.com.test.iseja.net. (46)
07:09:25.511226 IP 10.7.8.134.45846 > 10.9.9.9.53: 58855+ A? static.ui.com.test.iseja.net. (46)
07:20:57.353157 IP 10.7.8.134.42844 > 10.8.8.8.53: 55135+ [1au] A? github.com.test.iseja.net. (54)
07:20:57.354756 IP 10.7.8.134.42844 > 10.8.8.8.53: 44381+ [1au] A? github.com. (39)
07:23:57.748069 IP 10.7.8.134.48111 > 10.9.9.9.53: 60824+ [1au] AAAA? github.com.test.iseja.net. (54)
07:23:57.754750 IP 10.7.8.134.43014 > 10.8.8.8.53: 5445+ [1au] AAAA? github.com. (39)
07:24:57.265576 IP 10.7.8.134.38849 > 10.8.8.8.53: 8557+ [1au] AAAA? pve4.home.iseja.net.test.iseja.net. (63)
07:24:57.266842 IP 10.7.8.134.46952 > 10.9.9.9.53: 4035+ [1au] AAAA? pve4.home.iseja.net. (48)
07:25:56.863269 IP 10.7.8.134.55559 > 10.8.8.8.53: 8875+ [1au] A? pve4.home.iseja.net.test.iseja.net. (63)
07:25:57.299990 IP 10.7.8.134.52445 > 10.9.9.9.53: 19044+ [1au] A? pve4.home.iseja.net. (48)
```
